{
  "$schema": "https://json-schema.org/draft/2020-12/schema",
  "$id": "paygod/receipt.schema.json",
  "title": "PayGod Receipt",
  "type": "object",
  "additionalProperties": false,
  "required": [
    "api_version",
    "kind",
    "spec_version",
    "clock",
    "canonicalization",
    "runner",
    "pack",
    "input",
    "bundle",
    "verdict",
    "replay"
  ],
  "properties": {
    "api_version": {
      "type": "string",
      "const": "paygod/v1"
    },
    "kind": {
      "type": "string",
      "const": "Receipt"
    },
    "spec_version": {
      "type": "string",
      "pattern": "^[0-9]+\\.[0-9]+\\.[0-9]+$"
    },
    "generated_at": {
      "type": "string",
      "description": "Optional. When PAYGOD_CLOCK is injected, this equals that deterministic clock value. The supported non-strict local producer may emit the sentinel \"unset\"; verifier acceptance of that mode requires explicit --allow-unbound-clock opt-in."
    },
    "clock": {
      "type": "object",
      "additionalProperties": false,
      "required": [
        "value",
        "source"
      ],
      "properties": {
        "value": {
          "type": "string",
          "description": "Injected PAYGOD_CLOCK value, or the sentinel \"unset\" for the supported non-strict local mode."
        },
        "source": {
          "type": "string",
          "enum": [
            "env:PAYGOD_CLOCK"
          ]
        }
      }
    },
    "canonicalization": {
      "type": "object",
      "additionalProperties": false,
      "required": [
        "json"
      ],
      "properties": {
        "json": {
          "type": "string",
          "enum": [
            "paygod-c14n-v1"
          ]
        }
      }
    },
    "runner": {
      "type": "object",
      "additionalProperties": false,
      "required": [
        "image",
        "image_digest"
      ],
      "properties": {
        "image": {
          "type": "string"
        },
        "image_digest": {
          "type": "string"
        }
      }
    },
    "pack": {
      "type": "object",
      "additionalProperties": false,
      "required": [
        "name",
        "version",
        "path",
        "digest_sha256"
      ],
      "properties": {
        "name": {
          "type": "string"
        },
        "version": {
          "type": "string"
        },
        "path": {
          "type": "string"
        },
        "digest_sha256": {
          "type": "string",
          "pattern": "^[a-f0-9]{64}$"
        }
      }
    },
    "input": {
      "type": "object",
      "additionalProperties": false,
      "required": [
        "canonical_hash"
      ],
      "properties": {
        "canonical_hash": {
          "type": "string",
          "pattern": "^[a-f0-9]{64}$"
        }
      }
    },
    "bundle": {
      "type": "object",
      "additionalProperties": false,
      "required": [
        "bundle_digest",
        "manifest_sha256",
        "files"
      ],
      "properties": {
        "bundle_digest": {
          "type": "string",
          "pattern": "^[a-f0-9]{64}$"
        },
        "manifest_sha256": {
          "type": "string",
          "pattern": "^[a-f0-9]{64}$"
        },
        "files": {
          "type": "array",
          "minItems": 1,
          "items": {
            "type": "object",
            "additionalProperties": false,
            "required": [
              "name",
              "sha256",
              "bytes"
            ],
            "properties": {
              "name": {
                "type": "string"
              },
              "sha256": {
                "type": "string",
                "pattern": "^[a-f0-9]{64}$"
              },
              "bytes": {
                "type": "integer",
                "minimum": 0
              }
            }
          }
        }
      }
    },
    "verdict": {
      "type": "object",
      "additionalProperties": false,
      "required": [
        "value",
        "rule_name",
        "reason"
      ],
      "properties": {
        "value": {
          "type": "string",
          "enum": [
            "allow",
            "deny",
            "flag",
            "error"
          ]
        },
        "rule_name": {
          "type": "string"
        },
        "reason": {
          "type": "string"
        }
      }
    },
    "replay": {
      "type": "object",
      "additionalProperties": false,
      "required": [
        "command"
      ],
      "properties": {
        "command": {
          "type": "string"
        }
      }
    }
  }
}
